{
    "$schema": "http://json-schema.org/draft-06/schema#",
    "title": "FME Package Manifest",
    "description": "Manifest describing the content of an FME Package",
    "definitions": {
        "author": {
            "type": "object",
            "additionalProperties": false,
            "properties": {
                "name": {
                    "type": "string"
                },
                "email": {
                    "type": "string"
                }
            },
            "required": [
                "name"
            ]
        },
        "format": {
            "type": "object",
            "additionalProperties": false,
            "properties": {
                "name": {
                    "type": "string"
                },
                "short_name": {
                    "type": "string"
                },
                "categories": {
                    "type": "array",
                    "items": {
                        "type": "string"
                    }
                },
                "description": {
                    "type": "string"
                },
                "description_format": {
                    "type": "string",
                    "enum": [
                        "md",
                        "text",
                        "html"
                    ]
                },
                "fds_info": {
                    "type": "string"
                },
                "visible": {
                    "type": "boolean"
                }
            },
            "required": [
                "name",
                "short_name",
                "categories",
                "description",
                "description_format",
                "fds_info",
                "visible"
            ]
        },
        "transformer": {
            "type": "object",
            "additionalProperties": false,
            "properties": {
                "name": {
                    "type": "string"
                },
                "latest_version": {
                    "type": "integer"
                },
                "versions": {
                    "type": "array",
                    "items": {
                        "type": "object",
                        "properties": {
                            "name": {
                                "type": "string"
                            },
                            "version": {
                                "type": "integer"
                            },
                            "categories": {
                                "type": "array",
                                "items": {
                                    "type": "string"
                                }
                            },
                            "aliases": {
                                "type": "array",
                                "items": {
                                    "type": "string"
                                }
                            },
                            "visible": {
                                "type": "boolean"
                            },
                            "data_processing_types": {
                                "type": "array",
                                "items": {
                                    "type": "string",
                                    "enum": [
                                        "both",
                                        "neither",
                                        "source",
                                        "destination"
                                    ]
                                }
                            }
                        },
                        "required": [
                            "name",
                            "version",
                            "categories",
                            "aliases",
                            "visible"
                        ]
                    }
                },
                "description": {
                    "type": "string"
                },
                "description_format": {
                    "type": "string",
                    "enum": [
                        "md",
                        "text",
                        "html"
                    ]
                }
            },
            "required": [
                "name",
                "latest_version",
                "versions",
                "description",
                "description_format"
            ]
        },
        "web_service": {
            "type": "object",
            "additionalProperties": false,
            "properties": {
                "name": {
                    "type": "string"
                },
                "description": {
                    "type": "string"
                },
                "markdown_description": {
                    "type": "string"
                },
                "connection_description": {
                    "type": "string"
                },
                "markdown_connection_description": {
                    "type": "string"
                },
                "help_url": {
                    "type": "string"
                }
            },
            "required": [
                "name",
                "description",
                "markdown_description",
                "connection_description",
                "markdown_connection_description",
                "help_url"
            ]
        },
        "web_filesystem": {
            "type": "object",
            "additionalProperties": false,
            "properties": {
                "name": {
                    "type": "string"
                }
            },
            "required": [
                "name"
            ]
        },
        "python_package": {
            "type": "object",
            "additionalProperties": false,
            "properties": {
                "name": {
                    "type": "string"
                }
            },
            "required": [
                "name"
            ]
        },
        "entry_point": {
            "type": "object",
            "additionalProperties": false,
            "properties": {
                "platform": {
                    "type": "string"
                },
                "entry_point": {
                    "type": "string"
                }
            },
            "required": [
                "platform",
                "entry_point"
            ]
        },
        "background_worker": {
            "type": "object",
            "additionalProperties": false,
            "properties": {
                "name": {
                    "type": "string"
                },
                "entry_points": {
                    "type": "array",
                    "items": {
                        "type": "object",
                        "$ref": "#/definitions/entry_point"
                    }
                }
            },
            "required": [
                "name",
                "entry_points"
            ]
        }
    },
    "type": "object",
    "required": [
        "fpkg_version",
        "uid",
        "publisher_uid",
        "name",
        "description",
        "deprecated",
        "version",
        "minimum_fme_build",
        "author",
        "package_content",
        "categories"
    ],
    "additionalProperties": false,
    "properties": {
        "fpkg_version": {
            "description": "Format version for the package",
            "type": "integer",
            "enum": [
                1
            ]
        },
        "uid": {
            "description": "Unique identifier for the package",
            "type": "string",
            "pattern": "^[a-z0-9](?!.*--)[a-z0-9-]{1,30}[a-z0-9]$"
        },
        "publisher_uid": {
            "description": "Unique identifier for the package publisher",
            "type": "string",
            "pattern": "^[a-z0-9](?!.*--)[a-z0-9-]{1,30}[a-z0-9]$"
        },
        "name": {
            "description": "Name of the package",
            "type": "string"
        },
        "description": {
            "description": "Short description of the package purpose and content",
            "type": "string"
        },
        "deprecated": {
            "description": "Indicates if the package is deprecated",
            "type": "boolean"
        },
        "version": {
            "description": "Version of the package, using semantic versioning",
            "type": "string",
            "pattern": "^[0-9]{1,9}\\.[0-9]{1,9}\\.[0-9]{1,9}$"
        },
        "minimum_fme_build": {
            "description": "Minimum FME build to use the package",
            "type": "integer",
            "minimum": 19000
        },
        "unsupported_from_build": {
            "description": "This package is unsupported starting from this FME Build",
            "type": "integer",
            "minimum": 26000
        },
        "author": {
            "description": "Author of the package",
            "type": "object",
            "$ref": "#/definitions/author"
        },
        "categories": {
            "description": "Categories for the package",
            "type": "array",
            "items": {
                "type": "string"
            }
        },
        "package_content": {
            "description": "Components included in the package and to be deployed when the package is installed",
            "type": "object",
            "additionalProperties": false,
            "properties": {
                "formats": {
                    "description": "Formats included in the package",
                    "type": "array",
                    "items": {
                        "type": "object",
                        "$ref": "#/definitions/format"
                    },
                    "uniqueItems": true
                },
                "transformers": {
                    "description": "Transformers included in the package",
                    "type": "array",
                    "items": {
                        "type": "object",
                        "$ref": "#/definitions/transformer"
                    },
                    "uniqueItems": true
                },
                "web_services": {
                    "description": "Web services included in the package",
                    "type": "array",
                    "items": {
                        "type": "object",
                        "$ref": "#/definitions/web_service"
                    },
                    "uniqueItems": true
                },
                "web_filesystems": {
                    "description": "Web file systems included in the package",
                    "type": "array",
                    "items": {
                        "type": "object",
                        "$ref": "#/definitions/web_filesystem"
                    },
                    "uniqueItems": true
                },
                "python_packages": {
                    "description": "Python packages included in the package",
                    "type": "array",
                    "items": {
                        "type": "object",
                        "$ref": "#/definitions/python_package"
                    },
                    "uniqueItems": true
                },
                "background_workers": {
                    "description": "Background workers included in the package",
                    "type": "array",
                    "items": {
                        "type": "object",
                        "$ref": "#/definitions/background_worker"
                    },
                    "uniqueItems": true
                }
            }
        }
    }
}
